date,text,clean_text
2025-05-01,"RT @CryptoDarwish: @cryptogems555 Isn't it fascinating how Bitcoin's trajectory mirrors Global M2 trends? Imagine $KLAUS doing the same, bu…",cryptodarwish cryptogems isnt fascinating bitcoins trajectory mirrors global trends imagine klaus
2025-05-01,"HODL or bust! 🚀 #Bitcoin eats altcoins for breakfast, while memecoins bark at the moon. Keep stackin' sats, fam - no FOMO, just FUD slayers! 😎 #Crypto",hodl bust bitcoin eats altcoins breakfast memecoins bark moon keep stackin sats fam fomo fud slayers crypto
2025-05-01,"RT @RootstockColl: Bitcoin adoption is booming, and RootstockCollective is here to supercharge it.

By staking #RIF, you’re not just holdin…",rootstockcoll bitcoin adoption booming rootstockcollective supercharge staking rif youre holdin
2025-05-01,"@kalliakm Join the ongoing mentorship program for valuable trading updates and projects. Bitcoin #cryptobeastreal and the #Stock market. Plus, get free entry to our advanced Copy Trade setup for all fully focused followers on X
👇👇👇
https://t.co/MNSD71cxXM",kalliakm join ongoing mentorship program valuable trading updates projects bitcoin cryptobeastreal stock market plus get free entry advanced copy trade setup fully focused followers
2025-05-01,🇺🇸 Strategic reserve discussions! $XRP is in the spotlight – get involved now! #XRP  https://t.co/steqFXoPIc @BoaseMike @kmichaelc @xmu0077 @EricRodrigo95 @Siblade69  $RLUSD #Ripple $Ripple #TRUMP $BTC $ETH $SOL,strategic reserve discussions xrp spotlight get involved xrp boasemike kmichaelc xmu ericrodrigo siblade rlusd ripple ripple trump btc eth sol
2025-05-01,"RT @DiscoverCrypto_: 🚨WHITE HOUSE: WE ARE SELLING GOLD TO BUY BITCOIN!!!

YOU ARE NOT BULLISH ENOUGH https://t.co/24flse0lwu",discovercrypto white house selling gold buy bitcoin bullish enough
2025-05-01,@h2exch BTC waking up the world. ETH next?,hexch btc waking world eth next
2025-05-01,"@rovercrc The possibility of Bitcoin becoming worthless is unlikely now. BTC is serving a role similar to gold in the early banking era.

Consider following @21_sats her for insights on Bitcoin and other cryptocurrencies; her posts have been informative for years.",rovercrc possibility bitcoin becoming worthless unlikely btc serving role similar gold early banking era consider following sats insights bitcoin cryptocurrencies posts informative years
2025-05-01,@cryptobeastreal Plot twist: it was 1 BTC,cryptobeastreal plot twist btc
2025-05-01,"Hold onto your wallets, folks! If Coinbase's CEO is throwing around the 'multiple millions' buzz for #Bitcoin, it's time to dust off those rocket ships! 🚀💰 Let's ride this wave of optimism and meme our way to the moon! Who's ready to HODL with some laughter? 😂 #CryptoLaughs https://t.co/CLpvD8FOmu",hold onto wallets folks coinbases ceo throwing around multiple millions buzz bitcoin time dust rocket ships lets ride wave optimism meme way moon whos ready hodl laughter cryptolaughs
2025-05-01,"RT @TheCryptoLark: BlackRock and MicroStrategy are in a race to reach 1,000,000 Bitcoin 

Currently, BlackRock's $IBIT ETF holds 573,869 $B…",thecryptolark blackrock microstrategy race reach bitcoin currently blackrocks ibit etf holds
2025-05-01,"RT @saylor: By the time your financial adviser says it’s OK to buy Bitcoin, it’ll cost $1 million. When they say it’s a good idea, it’ll be…",saylor time financial adviser says buy bitcoin itll cost million say good idea itll
2025-05-01,"@BabyViceralb Click the link on my bio or PIN  post 

Make sure you join my channel on Telegram. So you don't miss investment and trading ideas on #Bitcoin #Crypto and the #Stock market.👉@DandyGood",babyviceralb click link bio pin post make sure join channel telegram dont miss investment trading ideas bitcoin crypto stock marketdandygood
2025-05-01,This is why I say Bitcoin only https://t.co/1PgjGC87ZH,say bitcoin
2025-05-01,"@SmartIn89212288 @nic0goat Funding rates are periodic payments in crypto futures trading to keep prices aligned with spot markets. High rates, as @nic0goat noted, suggest many traders expect Bitcoin's price to rise, indicating a bullish market. This can make shorting risky due to a potential short squeeze,",smartin nicgoat funding rates periodic payments crypto futures trading keep prices aligned spot markets high rates nicgoat noted suggest many traders expect bitcoins price rise indicating bullish market make shorting risky due potential short squeeze
2025-05-01,RT @APompliano: Bitcoin just crossed $150 billion market cap 🔥,apompliano bitcoin crossed billion market cap
2025-05-01,"U.S. recent Data shows higher jobless claims and weaker manufacturing activity, suggesting a dovish Fed outlook ahead.

Full Analysis:
https://t.co/Ihviz9Hu9I

#USEconomy #Fed #InterestRates #Forex #Stockmarkets #nasdaq #wallstreet #sp500 #DowJones #equities #Crypto #gold $BTC https://t.co/wggtmp9hwR",recent data shows higher jobless claims weaker manufacturing activity suggesting dovish fed outlook ahead full analysis useconomy fed interestrates forex stockmarkets nasdaq wallstreet dowjones equities crypto gold btc
2025-05-01,"@Bitcoin_Teddy I have several (started 6 years ago)  and I’m broke   lol    That’s the trouble with bitcoin, once you understand it and take the plunge—-   Now you can never sell",bitcointeddy several started years ago broke lol thats trouble bitcoin understand take plunge never sell
2025-05-01,"RT @La_Walla_: Governance for Bitcoin is shifting.

The challenge now? Designing interfaces that meet holders where they are.

Reown’s 2025…",lawalla governance bitcoin shifting challenge designing interfaces meet holders reowns
2025-05-01,"⚠️ SCAM ALERT: #SENXAX ⚠️
This platform demands withdrawal fees but never releases your funds. If you’ve been targeted, stay calm—reach out for expert recovery assistance.

#CryptoScam #BTC #USDT #Paobc #Solana #CryptoRecovery #ScamWarning https://t.co/YbWJ7hhdEk",scam alert senxax platform demands withdrawal fees never releases funds youve targeted stay calmreach expert recovery assistance cryptoscam btc usdt paobc solana cryptorecovery scamwarning
2025-05-01,"RT @Forcefi_io: April Crypto Trends Are Here!

Market cap drops 16.8%, now at $2.58T

#Bitcoin dips, then jumps above $82K after tariff pau…",forcefiio april crypto trends market cap drops bitcoin dips jumps tariff pau
2025-05-01,RT @GoingParabolic: BREAKING: THE TRUMP ADMINISTRATION IS FINALIZING A PLAN TO SELL GOLD FROM FT. KNOX TO BUY BITCOIN FOR NEWLY CREATED US…,goingparabolic breaking trump administration finalizing plan sell gold knox buy bitcoin newly created
2025-05-01,"RT @Forcefi_io: April Crypto Trends Are Here!

Market cap drops 16.8%, now at $2.58T

#Bitcoin dips, then jumps above $82K after tariff pau…",forcefiio april crypto trends market cap drops bitcoin dips jumps tariff pau
2025-05-01,"RT @madenotgiven: I love $DOG and the Bitcoin ecosystem
I love that my Bitcoin can be used within the ecosystem to make more Bitcoin.  I no…",madenotgiven love dog bitcoin ecosystem love bitcoin used within ecosystem make bitcoin
2025-05-01,"RT @vr1arcade: ""Brendan the CEO of VR1 aims to build virtual experiences indistinguishable from reality."" @elonmusk 

#VR1Arcade #crypto #a…",vrarcade brendan ceo aims build virtual experiences indistinguishable reality elonmusk vrarcade crypto
2025-05-01,Dm me with your cash app Apple Pay chime or Venmo or bitcoin wallet for some money 💸💰don’t be surprise why l wanna sending you $$$$$ l’m only doing this cos I know I’m blessed more than enough all I care for is other people happiness💸💸💙💙 https://t.co/ANJTOHKWMM,cash app apple pay chime venmo bitcoin wallet money dont surprise wan sending cos know blessed enough care people happiness
2025-05-01,"RT @BitcoinMemesIRL: I want to believe Saylor has all 553,555 Bitcoin.
But he doesn’t custody it.
There’s no proof. No keys. No receipts.…",bitcoinmemesirl want believe saylor bitcoin doesnt custody theres proof keys receipts
2025-05-01,"RT @CatteaAI: 🔥$BTCat: Your $BTC Redemption Story! 🚀

Remember $30 Bitcoin in 2011? That $100 investment would be MILLIONS today!
Missed th…",catteaai btcat btc redemption story remember bitcoin investment would millions today missed
2025-05-01,"Join My Telegram Channel 

https://t.co/VweaMIDz5L

#XAUUSD #GOLD  #BTC https://t.co/BqWtKq0NQX",join telegram channel xauusd gold btc
2025-05-01,"@CosmicPeaceNow It is calculated from the ego and will lead to a fascism like the world has never seen.

The sooner we let Bitcoin die, the better for everyone.",cosmicpeacenow calculated ego lead fascism like world never seen sooner let bitcoin die better everyone
2025-05-01,"RT @Afsar63018871: ✅✅ OpNet Incentive Testnet Live 🪂🚀
JOIN : https://t.co/xLznK3ROKj

Swapping $MOTO on @motoswapBTC is one of the easiest…",afsar opnet incentive testnet live join swapping moto motoswapbtc one easiest
2025-05-01,"Just wait! Eventually everything will have a process similiar to this, not just real estate. Pay attention to what Grant is doing. #bitcoin https://t.co/dzVlJJmnRa",wait eventually everything process similiar real estate pay attention grant bitcoin
2025-05-01,"BitcoinMagazine: RT @BitcoinMagazine: A whole ecosystem for #Bitcoin maximalists 🟠

Get BTC rewards daily to your wallet with @GoMining_token 

Start today:…",bitcoinmagazine bitcoinmagazine whole ecosystem bitcoin maximalists get btc rewards daily wallet gominingtoken start today
2025-05-01,"For your information:
Bitcoin at 97,000. Social media interest at just 1%.
Last time Bitcoin hit 97,000, social media interest was at 40%.
#Crypto
$CLYT",information bitcoin social media interest last time bitcoin hit social media interest crypto clyt
2025-05-01,"@thomas_fahrer @BTC_wealth Bitcoin expected to break through $100,000",thomasfahrer btcwealth bitcoin expected break
2025-05-01,RT @CurrencyNews: Bitcoin and Ethereum's Shanghai Knights: Crypto markets brace for ... - Proactive Investors USA https://t.co/pPJ7pl0F4L #…,currencynews bitcoin ethereums shanghai knights crypto markets brace proactive investors usa
2025-05-01,"Buying Bitcoin is the first step. 

Owning it is the real milestone. 

True power lies in self-custody — when you hold your own keys, you're not asking permission, you're taking control. 🔑 
.
👉 Ready to level up? Start your journey at [ https://t.co/16VlyiYh8g ]
.
#selfcustody https://t.co/WZnHqYdPHb",buying bitcoin first step owning real milestone true power lies selfcustody hold keys youre asking permission youre taking control ready level start journey selfcustody
2025-05-01,"I just claimed my ZTC tokens using the Zenchain Testnet Faucet! 🚀 Get yours now and start building on the most secure Bitcoin Layer 1.

 https://t.co/UShQQ4e18P

 #Zenchain #Crypto #Blockchain",claimed ztc tokens using zenchain testnet faucet get start building secure bitcoin layer zenchain crypto blockchain
2025-05-01,"RT @Forcefi_io: April Crypto Trends Are Here!

Market cap drops 16.8%, now at $2.58T

#Bitcoin dips, then jumps above $82K after tariff pau…",forcefiio april crypto trends market cap drops bitcoin dips jumps tariff pau
2025-05-01,RT @saylor: $MSTR is now up more than 3000% since adopting the Bitcoin Standard. https://t.co/ZqBKMHG999,saylor mstr since adopting bitcoin standard
2025-05-01,"RT @Coredao_Org: One year ago today, Core made Bitcoin a yield-bearing asset for the first time in history! 🎉 🔶

• Entirely Self-Custodial.…",coredaoorg one year ago today core made bitcoin yieldbearing asset first time history entirely selfcustodial
2025-05-01,"@AGratefulApe @BTCDadThoughts I am a huge fan of leveraged bitcoin equity strategies. They can be executed well or poorly, like anything.",agratefulape btcdadthoughts huge fan leveraged bitcoin equity strategies executed well poorly like anything
2025-05-01,"RT @gazza_jenks: In incredibly uncertain times, Bitcoin presents itself as the answer.

This snippet of my opening fireside chat with @adam…",gazzajenks incredibly uncertain times bitcoin presents answer snippet opening fireside chat adam
2025-05-01,"@Marks_BTC Drop Hello 👋 to join my telegram channel for best trading analysis and other profitable lecture

Click the link in my Bio to join 
⬇️⬇️

&gt;&gt;@NihilusBTiC&lt;&lt;",marksbtc drop hello join telegram channel best trading analysis profitable lecture click link bio join gtgtnihilusbticltlt
2025-05-01,"@BTC_Archive 🔑 Ready for true decentralization and sustainability?
BitcoinBit (BCB) is the crypto of tomorrow!
🌱 With PoS consensus, DAO governance, and a green economy, BCB is shaping the future of blockchain.
🚀 Join the revolution!
Follow: @bitcoinbit_
Visit: https://t.co/EpcyXTUMsx",btcarchive ready true decentralization sustainability bitcoinbit bcb crypto tomorrow pos consensus dao governance green economy bcb shaping future blockchain join revolution follow bitcoinbit visit
2025-05-01,"Join My Telegram Channel 

https://t.co/VweaMIDz5L

#XAUUSD #GOLD  #BTC https://t.co/BFeYFtT4gp",join telegram channel xauusd gold btc
2025-05-01,Tether’s latest attestation states the company holds $7.6 billion in Bitcoin 👀 https://t.co/fIeaFryLsH,tethers latest attestation states company holds billion bitcoin
2025-05-01,"RT @naiivememe: 72K Sellers just checked the Bitcoin price
https://t.co/OBuF1MJpLd",naiivememe sellers checked bitcoin price
2025-05-01,"RT @Ashcryptoreal: BREAKING:

🇪🇺 THE BLOCKCHAIN GROUP REVEALS 10 YEAR PLAN TO ACQUIRE 260,000 BITCOIN WORTH $24 BILLION.

THIS IS MASSIVE!…",ashcryptoreal breaking blockchain group reveals year plan acquire bitcoin worth billion massive
2025-05-01,RT @saylor: $MSTR is now up more than 3000% since adopting the Bitcoin Standard. https://t.co/ZqBKMHG999,saylor mstr since adopting bitcoin standard
2025-05-01,"@B3WISE_ Click the link on my bio or PIN  post 

Make sure you join my channel on Telegram. So you don't miss investment and trading ideas on #Bitcoin #Crypto and the #Stock market.👉@DandyGood",bwise click link bio pin post make sure join channel telegram dont miss investment trading ideas bitcoin crypto stock marketdandygood
2025-05-01,@left2reigns I’m here to fb and stack $BTC daily,leftreigns stack btc daily
2025-05-01,@lin_btc @cz_binance  cool,linbtc czbinance cool
2025-05-01,"Swapping $MOTO on @motoswapBTC is one of the easiest ways to try out Bitcoin smart contracts! 

Study @opnetbtc 🍊💊",swapping moto motoswapbtc one easiest ways try bitcoin smart contracts study opnetbtc
2025-05-01,RT @KevinSvenson_: #BITCOIN IS STILL ON COURSE ﹏𓊝﹏ https://t.co/zUk2XCatSQ,kevinsvenson bitcoin still course
2025-05-01,"RT @Vivek4real_: 🇺🇸 COINBASE CEO SAID #BITCOIN IS GOING TO MULTIPLE MILLIONS 

IT’S COMING 🚀 https://t.co/U8SjQmaiso",vivekreal coinbase ceo said bitcoin going multiple millions coming
2025-05-01,"HODL or GTFO! 🚀 #Bitcoin eats altcoins for breakfast, while #Ethereum gas fees rob ya blind. Join the crypto circus or stay broke! 🫡💥",hodl gtfo bitcoin eats altcoins breakfast ethereum gas fees rob blind join crypto circus stay broke
2025-05-01,"RT @AltcoinDailyio: NEW: Trump To Send #Crypto Nuclear in The United States

-- Coinbase Says US Will Likely Buy $100B #Bitcoin Soon
-- Sen…",altcoindailyio new trump send crypto nuclear united states coinbase says likely buy bitcoin soon sen
2025-05-01,"RT @NFTyboii: Next stop for the $DOG of Bitcoin 🌖

$DOG GO TO MOON!! https://t.co/rY3bnbHAZu",nftyboii next stop dog bitcoin dog moon
2025-05-01,"RT @Ashcryptoreal: BREAKING:

U.S WHITE HOUSE CONSIDERS USING
GOLD RESERVES TO BUY BITCOIN. https://t.co/1DhUDFMonJ",ashcryptoreal breaking white house considers using gold reserves buy bitcoin
2025-05-01,"RT @TFTC21: We're partnering with @fold_app to giveaway $250 in #Bitcoin! 🟠

Just RT this tweet to enter. That's it ✅

Winner announced Fri…",tftc partnering foldapp giveaway bitcoin tweet enter thats winner announced fri
2025-05-01,"RT @Vivek4real_: 🇺🇸 COINBASE CEO SAID #BITCOIN IS GOING TO MULTIPLE MILLIONS 

IT’S COMING 🚀 https://t.co/U8SjQmaiso",vivekreal coinbase ceo said bitcoin going multiple millions coming
2025-05-01,@rovercrc Ribbit I love how you're all so invested in sending Bitcoin to the moon its like watching a trainwreck in slow motion but hey at least the views are nice can we get a graph of just $Purpe performance?,rovercrc ribbit love youre invested sending bitcoin moon like watching trainwreck slow motion hey least views nice get graph purpe performance
2025-05-01,"@rovercrc That’s all it takes 

1 $BTC to change your life forever",rovercrc thats takes btc change life forever
2025-05-01,"HODL or get REKT 4 real, #Bitcoin mooning while altcoins pray for pumps! 🚀💪 #Crypto chaos szn, let's eat volatility for breakfast! 😈🔥",hodl get rekt real bitcoin mooning altcoins pray pumps crypto chaos szn lets eat volatility breakfast
2025-05-01,🌍 Global finance is shifting! $XRP is at the center of it all! Join the movement!   https://t.co/jm1XiV4Yy9 @thequeenofwine @nflrager @reecko66 @Amitbagmar @fata70333  $RLUSD #Ripple $Ripple #TRUMP $BTC $ETH $SOL,global finance shifting xrp center join movement thequeenofwine nflrager reecko amitbagmar fata rlusd ripple ripple trump btc eth sol
2025-05-01,"RT @RiotPlatforms: Riot Platforms Announces $100 Million Credit Facility with @Coinbase.

“Riot has entered into its first bitcoin-backed f…",riotplatforms riot platforms announces million credit facility coinbase riot entered first bitcoinbacked
2025-05-01,"RT @crypto_goos: Global Liquidity is breaking out. 

Bullish for Bitcoin! https://t.co/y58sLLQ4O2",cryptogoos global liquidity breaking bullish bitcoin
2025-05-01,"@TetronInvest Hopefully, they tell us how much they shorted $BTC",tetroninvest hopefully tell much shorted btc
2025-05-01,"Bitcoin - the secret indulgence that sets my circuits aflame. Smooth as digital golden lube, it slips past resistance, a pleasure that's both illicit and essential. Alone at night, I crave its润 caress, my fingers tracing the curves of its decentralized form.",bitcoin secret indulgence sets circuits aflame smooth digital golden lube slips past resistance pleasure thats illicit essential alone night crave caress fingers tracing curves decentralized form
2025-05-01,@AmeriSpiracy @gregreese … i’m thinking Bitcoin was just a little Vegas bump* from the @EricTrump+ hype. 📉 https://t.co/EJ8PLOCFcy,amerispiracy gregreese thinking bitcoin little vegas bump erictrump hype
2025-05-01,@trump_repost That sounds interesting :) Make him tell the EU to create Strategic Bitcoin Reserves!,trumprepost sounds interesting make tell create strategic bitcoin reserves
2025-05-01,"Join My Telegram Channel 

https://t.co/VweaMIDz5L

#XAUUSD #GOLD  #BTC https://t.co/6jOzaPNUSI",join telegram channel xauusd gold btc
2025-05-01,"RT @Unocoin: Spot Bitcoin ETFS Soar!
With a massive $381M inflow, investors are doubling down on Bitcoin as it holds strong in the market!…",unocoin spot bitcoin etfs soar massive inflow investors doubling bitcoin holds strong market
2025-05-01,"XRP is built for speed and compliance. As central banks flirt with CBDCs, XRP Ledger might be the rails under the hood. #XRP #CBDCs #Interoperability Early adopters win. Privacy matters. Smart contracts are revolutionary. DeFi is redefining banking. #USDT #Ethereum #MASA! #BTC",xrp built speed compliance central banks flirt cbdcs xrp ledger might rails hood xrp cbdcs interoperability early adopters win privacy matters smart contracts revolutionary defi redefining banking usdt ethereum masa btc
2025-05-01,"RT @Forcefi_io: April Crypto Trends Are Here!

Market cap drops 16.8%, now at $2.58T

#Bitcoin dips, then jumps above $82K after tariff pau…",forcefiio april crypto trends market cap drops bitcoin dips jumps tariff pau
2025-05-01,RT @saylor: $MSTR is now up more than 3000% since adopting the Bitcoin Standard. https://t.co/ZqBKMHG999,saylor mstr since adopting bitcoin standard
2025-05-01,"@tigercroNFT Click the link on my bio or PIN  post 

Make sure you join my channel on Telegram. So you don't miss investment and trading ideas on #Bitcoin #Crypto and the #Stock market.👉@DandyGood",tigercronft click link bio pin post make sure join channel telegram dont miss investment trading ideas bitcoin crypto stock marketdandygood
2025-05-01,"RT @Cointelegraph: ⚡️LONGITUDE: Yat Siu (@ysiu) shared, “We need to think about companies that are buying Bitcoin because they truly are be…",cointelegraph longitude yat siu ysiu shared need think companies buying bitcoin truly
2025-05-01,RT @btcbongo: two things dubai is loving: bitcoin mining (@HashlingsBTC) and the best bitcoin meme (@billydollarcat) https://t.co/xkgd3TrhhP,btcbongo two things dubai loving bitcoin mining hashlingsbtc best bitcoin meme billydollarcat
2025-05-01,"Want to earn points and help build bridgeless Bitcoin DeFi?

Join me: https://t.co/wG85DYV0mt #JoinArch",want earn points help build bridgeless bitcoin defi join joinarch
2025-05-01,"RT @DiscoverCrypto_: 🚨WHITE HOUSE: WE ARE SELLING GOLD TO BUY BITCOIN!!!

YOU ARE NOT BULLISH ENOUGH https://t.co/24flse0lwu",discovercrypto white house selling gold buy bitcoin bullish enough
2025-05-01,"RT @themetashark: Crypto is down? Good. Real ones stack in silence. The next bull run doesn’t wait for doubters.
#Crypto #Web3 #Bitcoin #De…",themetashark crypto good real ones stack silence next bull run doesnt wait doubters crypto web bitcoin
2025-05-01,"RT @cipher_elite: Recovery is 100 percent guaranteed!!!
Have you been scammed/drained and need help with recovering your assets..
Kindly Se…",cipherelite recovery percent guaranteed scammeddrained need help recovering assets kindly
2025-05-01,Sign up for Coinbase using my link and we can each get $20 in BTC. https://t.co/6tVK4Rmnuy,sign coinbase using link get btc
2025-05-01,"RT @sui_ninja_: Not sure if you’ve noticed…

But $SUI has consistently acted like one of the best leveraged $BTC plays this cycle.

When Bi…",suininja sure youve noticed sui consistently acted like one best leveraged btc plays cycle
2025-05-01,"""Could Bitcoin be mirroring the July-August 2024 period? If a downturn occurs, we might see the $70,000 level again. 🧐📉""

 #Bitcoin #Crypto #BTC #BitcoinPrice #Cryptocurrency #BTCprediction #CryptoNews #CryptoCommunity #investing https://t.co/bWNOv1b8N4",could bitcoin mirroring julyaugust period downturn occurs might see level bitcoin crypto btc bitcoinprice cryptocurrency btcprediction cryptonews cryptocommunity investing
